{
  "version": 1,
  "backend": "ultralytics_yolo",
  "model_id": "Ultralytics.YOLO26m.COCO",
  "revision": "ultralytics-assets-v8.4.0",
  "filename": "yolo26m.pt",
  "sha256": "401cea9ab23ad19246ff7744859816bc599f350e93c9dd30367b6f0a0745d0b7",
  "size_bytes": 44255705,
  "source_url": "https://github.com/ultralytics/assets/releases/download/v8.4.0/yolo26m.pt",
  "license_spdx": "AGPL-3.0",
  "license_url": "https://www.ultralytics.com/license",
  "labels": [
    "person",
    "bicycle",
    "car",
    "motorcycle",
    "airplane",
    "bus",
    "train",
    "truck",
    "boat",
    "traffic light",
    "fire hydrant",
    "stop sign",
    "parking meter",
    "bench",
    "bird",
    "cat",
    "dog",
    "horse",
    "sheep",
    "cow",
    "elephant",
    "bear",
    "zebra",
    "giraffe",
    "backpack",
    "umbrella",
    "handbag",
    "tie",
    "suitcase",
    "frisbee",
    "skis",
    "snowboard",
    "sports ball",
    "kite",
    "baseball bat",
    "baseball glove",
    "skateboard",
    "surfboard",
    "tennis racket",
    "bottle",
    "wine glass",
    "cup",
    "fork",
    "knife",
    "spoon",
    "bowl",
    "banana",
    "apple",
    "sandwich",
    "orange",
    "broccoli",
    "carrot",
    "hot dog",
    "pizza",
    "donut",
    "cake",
    "chair",
    "couch",
    "potted plant",
    "bed",
    "dining table",
    "toilet",
    "tv",
    "laptop",
    "mouse",
    "remote",
    "keyboard",
    "cell phone",
    "microwave",
    "oven",
    "toaster",
    "sink",
    "refrigerator",
    "book",
    "clock",
    "vase",
    "scissors",
    "teddy bear",
    "hair drier",
    "toothbrush"
  ],
  "subject_identity_inference": false
}
